name,town,capacity,roofed,latitude,longitude,url
Auditori Alfons Vallhonrat(Centre Cultural Caixa de Terrassa) de Tarrasa/Terrassa,Terrassa,733,True,41.5636455,2.0079886499999997,https://www.proyectomire.org/web/datosrecinto.php?id=1
Auditori Ribarroja de Ribarroja del Turia,Riba-roja de Túria,783,True,39.5407009,-0.5706477,https://www.proyectomire.org/web/datosrecinto.php?id=2
Auditori polivalent(Centre Cultural) de Granollers,Granollers,349,True,41.607521318008864,2.2820245014183436,https://www.proyectomire.org/web/datosrecinto.php?id=3
Auditorio(Casa Municipal de Cultura) de Avilés,,677,True,,,https://www.proyectomire.org/web/datosrecinto.php?id=4
Auditorio Manuel de Falla(Centro Cultural Manuel de Falla) de Granada,Granada,1313,True,37.17354832838734,-3.5884359562339676,https://www.proyectomire.org/web/datosrecinto.php?id=5
Auditorio Municipal(Ayuntamiento) de Logroño,Logroño,800,True,42.463899616793626,-2.432860060361617,https://www.proyectomire.org/web/datosrecinto.php?id=6
Auditorio Municipal Maestro Padilla de Almería,Almería,966,True,36.82327470767095,-2.4445532620900283,https://www.proyectomire.org/web/datosrecinto.php?id=7
Can Massallera de Sant Boi de Llobregat,Sant Boi de Llobregat,375,True,41.3421431,2.0431593,https://www.proyectomire.org/web/datosrecinto.php?id=8
Casa de Cultura de Puçol de Puçol,Puçol,329,True,39.61662752485926,-0.30845185587297275,https://www.proyectomire.org/web/datosrecinto.php?id=9
Cátedra Jovellanos(Cátedra de E. U. ´´Gaspar Melchor de Jovellanos´´) de Gijón,Gijón / Xixón,500,True,43.54278345395527,-5.663085426478512,https://www.proyectomire.org/web/datosrecinto.php?id=10
Teatro Juan Luis Galiardo de San Roque,San Roque,670,True,36.21003935,-5.388292377875176,https://www.proyectomire.org/web/datosrecinto.php?id=12
Cine-Teatro Filarmónica de Oviedo,Oviedo,1221,True,43.36254485,-5.846429934052317,https://www.proyectomire.org/web/datosrecinto.php?id=13
Escalante Centre Teatral de Valencia,Elx / Elche,400,True,38.2766616,-0.6772416,https://www.proyectomire.org/web/datosrecinto.php?id=14
Escuela Navarra de Teatro de Pamplona,,300,True,,,https://www.proyectomire.org/web/datosrecinto.php?id=15
Gran Teatro Falla de Cádiz,Cádiz,1214,True,36.53367865,-6.302112149999999,https://www.proyectomire.org/web/datosrecinto.php?id=16
Jove Teatre Regina de Barcelona,Barcelona,337,True,41.3968327,2.1561511,https://www.proyectomire.org/web/datosrecinto.php?id=17
L´Espai de Barcelona,Barcelona,370,True,41.3944931,2.14700475,https://www.proyectomire.org/web/datosrecinto.php?id=18
Palacio de Congresos de Jaca,Jaca,532,True,42.57481885,-0.5468783433419717,https://www.proyectomire.org/web/datosrecinto.php?id=19
Paraninfo de La Magdalena de Santander,,318,True,,,https://www.proyectomire.org/web/datosrecinto.php?id=20
Paraninfo de la Universidad de La Laguna(Universidad - Edificio Central) de La Laguna,,600,True,,,https://www.proyectomire.org/web/datosrecinto.php?id=21
Paraninfo de Las Llamas(Pabellón central) de Santander,Santander,0,True,43.47322485,-3.7953595492099623,https://www.proyectomire.org/web/datosrecinto.php?id=22
Pere Gran Maristany(El Casino) de El Masnou,el Masnou,700,True,41.483573,2.3276662,https://www.proyectomire.org/web/datosrecinto.php?id=23
Real Cinema de Madrid,,394,True,,,https://www.proyectomire.org/web/datosrecinto.php?id=24
Sala 1(Serantes Kultur Aretoa) de Santurtzi,Santurtzi,665,True,43.326769856992854,-3.0337688443605493,https://www.proyectomire.org/web/datosrecinto.php?id=25
Escena Miriñaque de Santander,,0,True,,,https://www.proyectomire.org/web/datosrecinto.php?id=26
Sala A(Teatro Central) de Sevilla,,500,True,,,https://www.proyectomire.org/web/datosrecinto.php?id=27
"Sala A, ´´Iturbi´´(Palau de la Música i Congressos de Valencia) de Valencia",València,1792,True,39.4661802,-0.360453918832513,https://www.proyectomire.org/web/datosrecinto.php?id=28
Sala Argenta(Palacio de Festivales de Cantabria) de Santander,Santander,1642,True,43.46232165,-3.7888564837101066,https://www.proyectomire.org/web/datosrecinto.php?id=29
Sala Ateneu(Ateneu de Sant Just Desvern) de Sant Just Desvern,Sant Just Desvern,460,True,41.381740650000005,2.0768274499999997,https://www.proyectomire.org/web/datosrecinto.php?id=30
"Sala B, ´´Rodrigo´´(Palau de la Música i Congressos de Valencia) de Valencia",València,420,True,39.4661802,-0.360453918832513,https://www.proyectomire.org/web/datosrecinto.php?id=31
Sala d´Actes(Centre Cultural Caixa de Terrassa) de Tarrasa/Terrassa,Terrassa,310,True,41.5636455,2.0079886499999997,https://www.proyectomire.org/web/datosrecinto.php?id=33
Sala de Cultura Gonzalo de Berceo de Logroño,,215,True,,,https://www.proyectomire.org/web/datosrecinto.php?id=34
Sala Fernando de Rojas(Círculo de Bellas Artes) de Madrid,Madrid,590,True,40.4182074,-3.696513838467072,https://www.proyectomire.org/web/datosrecinto.php?id=35
Sala Luis Galve(Auditorio-Palacio de Congresos) de Zaragoza,Zaragoza,429,True,41.6382304,-0.9012271,https://www.proyectomire.org/web/datosrecinto.php?id=36
Sala Medicina(Facultad de Medicina) de Santander,Santander,420,True,43.457168245166315,-3.8486635274741627,https://www.proyectomire.org/web/datosrecinto.php?id=37
Sala Mozart(Auditorio-Palacio de Congresos) de Zaragoza,Zaragoza,1992,True,41.6382304,-0.9012271,https://www.proyectomire.org/web/datosrecinto.php?id=38
Sala Multiusos ´Cesaraugusta´(Auditorio-Palacio de Congresos) de Zaragoza,Zaragoza,2500,True,41.6382304,-0.9012271,https://www.proyectomire.org/web/datosrecinto.php?id=39
Sala Pereda(Palacio de Festivales de Cantabria) de Santander,Santander,566,True,43.46232165,-3.7888564837101066,https://www.proyectomire.org/web/datosrecinto.php?id=40
Sala Rialto(Teatre Cine Rialto) de Valencia,València,391,True,39.4709608,-0.3762924,https://www.proyectomire.org/web/datosrecinto.php?id=41
Sala Valle-Inclán(Real Escuela Superior de Arte Dramático-RESAD) de Madrid,Madrid,498,True,40.41034485,-3.6745603283650423,https://www.proyectomire.org/web/datosrecinto.php?id=42
Salón de Actos(Centro Cívico Los Canapés) de Avilés,Avilés,364,True,43.54627228904066,-5.915764113955044,https://www.proyectomire.org/web/datosrecinto.php?id=43
Teatro CASYC de Santander,Santander,500,True,43.464658650000004,-3.805814573853712,https://www.proyectomire.org/web/datosrecinto.php?id=44
Salón de Actos(Palacio de Congresos y Exposiciones) de Gijón,,730,True,,,https://www.proyectomire.org/web/datosrecinto.php?id=45
Teatre Ateneu de Tàrrega,Tàrrega,552,True,41.6478307,1.1418977406196398,https://www.proyectomire.org/web/datosrecinto.php?id=47
Teatre Bartrina de Reus,,435,True,,,https://www.proyectomire.org/web/datosrecinto.php?id=48
Teatre Condal de Barcelona,Barcelona,722,True,41.3747756,2.1644681,https://www.proyectomire.org/web/datosrecinto.php?id=49
Teatre Conservatori de Manresa,Manresa,566,True,41.7247903,1.8233415,https://www.proyectomire.org/web/datosrecinto.php?id=50
Teatre de Salt de Salt,,274,True,,,https://www.proyectomire.org/web/datosrecinto.php?id=51
Teatre del Sol de Sabadell,Sabadell,185,True,41.54576663489412,2.108840497245217,https://www.proyectomire.org/web/datosrecinto.php?id=52
Teatre Lliure Gràcia de Barcelona,Barcelona,315,True,41.4027189,2.1559586,https://www.proyectomire.org/web/datosrecinto.php?id=53
Teatre Modern de El Prat de Llobregat,el Prat de Llobregat,482,True,41.33033145,2.092716653182241,https://www.proyectomire.org/web/datosrecinto.php?id=54
Teatre Municipal de Balaguer,,700,True,,,https://www.proyectomire.org/web/datosrecinto.php?id=55
Teatre Municipal de Girona(Ayuntamiento de Girona) de Gerona/Girona,,596,True,,,https://www.proyectomire.org/web/datosrecinto.php?id=56
Teatre Municipal La Faràndula de Sabadell,Sabadell,1069,True,41.54631365,2.1139567505635526,https://www.proyectomire.org/web/datosrecinto.php?id=57
Teatre Principal de Badalona,Badalona,350,True,41.45196827044486,2.2495243296278757,https://www.proyectomire.org/web/datosrecinto.php?id=58
Teatre Principal de Barcelona,,929,True,,,https://www.proyectomire.org/web/datosrecinto.php?id=59
Teatre Principal de Olot,,544,True,,,https://www.proyectomire.org/web/datosrecinto.php?id=60
Teatre Principal de Valencia,València,1226,True,39.47074535,-0.3744734278807535,https://www.proyectomire.org/web/datosrecinto.php?id=61
Teatre Romea de Barcelona,,615,True,,,https://www.proyectomire.org/web/datosrecinto.php?id=62
Teatre Victòria de Barcelona,Barcelona,1134,True,41.37498731676953,2.1656616860215574,https://www.proyectomire.org/web/datosrecinto.php?id=63
Teatro Soho Caixabank de Málaga,,579,True,,,https://www.proyectomire.org/web/datosrecinto.php?id=64
Teatro Albéniz de Madrid,Las Rozas de Madrid,1040,True,40.5229103,-3.8909015833788207,https://www.proyectomire.org/web/datosrecinto.php?id=65
Teatro Auditorio Ciudad de Alcobendas de Alcobendas,Alcobendas,989,True,40.54697738565614,-3.641612355606292,https://www.proyectomire.org/web/datosrecinto.php?id=66
Teatro Banda Primitiva de Lliria de Lliria,Llíria,967,True,39.62781492065697,-0.5978313682229206,https://www.proyectomire.org/web/datosrecinto.php?id=67
Sala 1(Barakaldo Antzokia) de Barakaldo,,673,True,,,https://www.proyectomire.org/web/datosrecinto.php?id=68
Teatro Bellas Artes de Tarazona,Tarazona,577,True,41.90523,-1.7242485690226184,https://www.proyectomire.org/web/datosrecinto.php?id=69
Teatro Bretón de los Herreros de Logroño,Logroño,988,True,42.464922099999995,-2.4485152040404206,https://www.proyectomire.org/web/datosrecinto.php?id=70
Teatro Bulevar(Casa de Cultura) de Torrelodones,,463,True,40.57960855,-3.9566660344640416,https://www.proyectomire.org/web/datosrecinto.php?id=71
Teatro Capitol de Calatayud,,545,True,,,https://www.proyectomire.org/web/datosrecinto.php?id=72
Teatro Cerezo de Carmona,Carmona,985,True,37.47044985532939,-5.644501524389447,https://www.proyectomire.org/web/datosrecinto.php?id=73
Teatro Cervantes de Arnedo,Arnedo,472,True,42.229069068589006,-2.091152238023698,https://www.proyectomire.org/web/datosrecinto.php?id=74
Teatro Cine Comtal de Ripoll,Ripoll,564,True,42.200014178779135,2.189122173082281,https://www.proyectomire.org/web/datosrecinto.php?id=75
Teatro de la Comedia de Madrid,Madrid,845,True,40.4156155,-3.7003987,https://www.proyectomire.org/web/datosrecinto.php?id=78
Teatro de la Latina de Madrid,Madrid,913,True,40.41156575,-3.708773605907534,https://www.proyectomire.org/web/datosrecinto.php?id=79
Teatro de la Villa de Ejea de los Caballeros,,433,True,,,https://www.proyectomire.org/web/datosrecinto.php?id=80
Teatro de la Zarzuela de Madrid,Madrid,1242,True,40.41725705,-3.697192930781628,https://www.proyectomire.org/web/datosrecinto.php?id=81
Teatro de Madrid de Madrid,Madrid,865,True,40.48285271407203,-3.702216646739411,https://www.proyectomire.org/web/datosrecinto.php?id=82
Teatro de Verano de Puerto Real,,2000,False,,,https://www.proyectomire.org/web/datosrecinto.php?id=83
Teatro de Verano José María Pemán de Cádiz,,2548,False,,,https://www.proyectomire.org/web/datosrecinto.php?id=84
Teatro Español de Madrid,Madrid,741,True,40.4258351,-3.6802814,https://www.proyectomire.org/web/datosrecinto.php?id=85
Gran Teatro Fleta de Zaragoza,,1698,True,,,https://www.proyectomire.org/web/datosrecinto.php?id=86
Teatro Gayarre de Pamplona,,864,True,,,https://www.proyectomire.org/web/datosrecinto.php?id=87
Teatro Getxo/ Getxo Antzokia de Getxo,,0,False,0,0,https://www.proyectomire.org/web/datosrecinto.php?id=88
Teatro Jovellanos de Gijón,Gijón / Xixón,1123,True,43.539772095830834,-5.661585202478845,https://www.proyectomire.org/web/datosrecinto.php?id=89
Sala Cándido Lara(Teatro Lara) de Madrid,Madrid,464,True,40.4221297,-3.7043663,https://www.proyectomire.org/web/datosrecinto.php?id=90
Teatro Lope de Vega de Madrid,Madrid,1434,True,40.4217768,-3.70869,https://www.proyectomire.org/web/datosrecinto.php?id=91
Teatro María Guerrero de Madrid,,622,True,,,https://www.proyectomire.org/web/datosrecinto.php?id=92
Teatro Cervantes de Málaga,Málaga,1134,True,36.72475726309074,-4.4181900064860455,https://www.proyectomire.org/web/datosrecinto.php?id=94
Teatro Municipal de Alcañiz,,332,True,,,https://www.proyectomire.org/web/datosrecinto.php?id=95
Teatro Municipal Enrique de la Cuadra de Utrera,Utrera,525,True,37.19213224249142,-5.799559498494321,https://www.proyectomire.org/web/datosrecinto.php?id=96
Teatro Municipal F. G. Lorca(Centro Cultural F. G. Lorca) de San Fernando de Henares,San Fernando de Henares,466,True,40.42454914857131,-3.52863455359894,https://www.proyectomire.org/web/datosrecinto.php?id=97
Teatro Municipal Isabel la Católica de Granada,Granada,574,True,37.1727515,-3.5989994,https://www.proyectomire.org/web/datosrecinto.php?id=98
Teatro Olimpia de Huesca,Huesca/Uesca,774,True,42.14036270915196,-0.41116263061754976,https://www.proyectomire.org/web/datosrecinto.php?id=99
Teatro Palacio Valdés de Avilés,Avilés,747,True,43.55531805,-5.920024764617039,https://www.proyectomire.org/web/datosrecinto.php?id=100
Sa Societat de Calvià,,227,True,,,https://www.proyectomire.org/web/datosrecinto.php?id=101
Teatro Oscense de Huéscar,Huéscar,301,True,37.8121435,-2.540407550717143,https://www.proyectomire.org/web/datosrecinto.php?id=102
Teatro Poliorama de Barcelona,,705,True,,,https://www.proyectomire.org/web/datosrecinto.php?id=103
Teatro Principal de Puerto Real,Puerto Real,406,True,36.532250575480745,-6.200490058105249,https://www.proyectomire.org/web/datosrecinto.php?id=104
Teatro Principal de Reinosa,Reinosa,351,True,43.0020457,-4.136461334593908,https://www.proyectomire.org/web/datosrecinto.php?id=105
Teatro Principal de Zaragoza,,914,True,,,https://www.proyectomire.org/web/datosrecinto.php?id=106
Teatro Real de Madrid,Madrid,1476,True,40.41815215,-3.709463045445115,https://www.proyectomire.org/web/datosrecinto.php?id=107
Teatro Salesiano de Huesca,Huesca/Uesca,569,True,42.1422564,-0.4120400383457926,https://www.proyectomire.org/web/datosrecinto.php?id=108
Teatro Salón Cervantes de Alcalá de Henares,Alcalá de Henares,454,True,40.4832891,-3.3646958500000004,https://www.proyectomire.org/web/datosrecinto.php?id=109
Teatro Social/Social Antzokia de Basauri,Basauri,754,True,43.23584347119878,-2.8868933131885957,https://www.proyectomire.org/web/datosrecinto.php?id=110
Teatro Villamarta de Jerez de la Frontera,,1216,True,,,https://www.proyectomire.org/web/datosrecinto.php?id=111
La Sala Teatre Municipal de Rubi,Rubí,567,True,41.487969189626504,2.0344469462111117,https://www.proyectomire.org/web/datosrecinto.php?id=112
Teatro Marquina de Madrid,Madrid,500,True,40.421955,-3.6938248,https://www.proyectomire.org/web/datosrecinto.php?id=113
Teatro Municipal(Casa de Cultura) de Tres Cantos,Tres Cantos,434,True,40.599276,-3.7109882544634587,https://www.proyectomire.org/web/datosrecinto.php?id=114
Centro Cívico Rigoberta Menchú de Leganés,Leganés,300,True,40.335303083462186,-3.7455513492740278,https://www.proyectomire.org/web/datosrecinto.php?id=115
Real Coliseo de Carlos III de San Lorenzo del Escorial,,500,True,,,https://www.proyectomire.org/web/datosrecinto.php?id=116
Teatro Auditorio Mpal. Adolfo Marsillach(C. S.C. P. Iglesias) de San Sebastián de los Reyes,,701,True,0,0,https://www.proyectomire.org/web/datosrecinto.php?id=117
Teatro Centro de Navalcarnero,,338,True,,,https://www.proyectomire.org/web/datosrecinto.php?id=118
Auditorio Joaquín Rodrigo(Centro Cultural Isabel de Farnesio) de Aranjuez,Aranjuez,404,True,40.0328095,-3.60177,https://www.proyectomire.org/web/datosrecinto.php?id=119
Teatro Municipal José María Rodero de Torrejón de Ardoz,,505,True,,,https://www.proyectomire.org/web/datosrecinto.php?id=120
Teatro Sanpol de Madrid,Madrid,532,True,40.423949050000004,-3.7269810638801273,https://www.proyectomire.org/web/datosrecinto.php?id=121
Teatro Cervantes de Almería,Almería,500,True,36.83729150306178,-2.4637155484489277,https://www.proyectomire.org/web/datosrecinto.php?id=122
Teatro Martín Recuerda(Casa de la Cultura) de Almuñécar,Almuñécar,456,True,36.73525146909017,-3.6898596729351976,https://www.proyectomire.org/web/datosrecinto.php?id=123
La Nube(Palacio de Exposiciones y Congresos) de Granada,Granada,638,False,37.16477937694751,-3.600357231174426,https://www.proyectomire.org/web/datosrecinto.php?id=124
Teatro Municipal Alameda de Sevilla,Sevilla,416,True,37.4019118,-5.9945602404816345,https://www.proyectomire.org/web/datosrecinto.php?id=125
Teatro Guimerá de Santa Cruz de Tenerife,Santa Cruz de Tenerife,854,True,28.46547115,-16.250448141433118,https://www.proyectomire.org/web/datosrecinto.php?id=126
Sala Sinfónica(Auditorio de Tenerife Adán Martín) de Santa Cruz de Tenerife,,1616,True,0,0,https://www.proyectomire.org/web/datosrecinto.php?id=127
Zornotza Aretoa de Amorebieta-Etxano,Amorebieta-Etxano,363,True,43.219900349999996,-2.73198635,https://www.proyectomire.org/web/datosrecinto.php?id=129
Teatre Auditori(Centre Cultural Sant Cugat) de Sant Cugat del Vallès,Sant Cugat del Vallès,920,True,41.4694664,2.0888249471264366,https://www.proyectomire.org/web/datosrecinto.php?id=130
Teatre Guasch de Barcelona,,310,True,,,https://www.proyectomire.org/web/datosrecinto.php?id=131
Teatre Borràs de Barcelona,Barcelona,737,True,41.3888477,2.1735904,https://www.proyectomire.org/web/datosrecinto.php?id=132
Teatre Grec de Barcelona,,1950,False,,,https://www.proyectomire.org/web/datosrecinto.php?id=133
Teatre Josep María de Sagarra de Santa Coloma de Gramanet,Santa Coloma de Gramenet,550,True,41.45140575,2.20534255,https://www.proyectomire.org/web/datosrecinto.php?id=134
Palau de la Música Catalana de Barcelona,Badalona,2138,True,41.44852275,2.24922325,https://www.proyectomire.org/web/datosrecinto.php?id=135
Salón de Actos(Casa de Cultura) de Villarrobledo,Villarrobledo,320,True,39.26269694052307,-2.606138365608421,https://www.proyectomire.org/web/datosrecinto.php?id=137
Teatro Cine Archena Parque de Archena,Archena,600,True,38.1163979711492,-1.297704787288487,https://www.proyectomire.org/web/datosrecinto.php?id=138
Auditorio Municipal Tierno Galván de Alhama de Murcia,Alhama de Murcia,1000,False,37.85175255,-1.43548735,https://www.proyectomire.org/web/datosrecinto.php?id=139
Teatro Municipal Juan Bernabé de Lebrija,Lebrija,467,True,36.91797812090889,-6.063854026722788,https://www.proyectomire.org/web/datosrecinto.php?id=140
Gran Teatro de Córdoba,Córdoba,946,True,37.88909667531115,-4.782753128059427,https://www.proyectomire.org/web/datosrecinto.php?id=141
Teatro Cine Municipal de Icod de los Vinos,,682,True,,,https://www.proyectomire.org/web/datosrecinto.php?id=142
Teatro Victoria Eugenia de San Sebastián/Donostia,Donostia / San Sebastián,910,True,43.32191495458771,-1.9798594946474415,https://www.proyectomire.org/web/datosrecinto.php?id=144
Teatro Principal de San Sebastián/Donostia,,500,True,,,https://www.proyectomire.org/web/datosrecinto.php?id=145
Auditorio Municipal(Centro Sociocultural) de L´Eliana,l'Eliana,640,True,39.56670329997598,-0.5341578072454298,https://www.proyectomire.org/web/datosrecinto.php?id=146
Teatre-Auditori Camp de Mart de Tarragona,Tarragonès,1787,True,41.1739465975855,1.2706855685144918,https://www.proyectomire.org/web/datosrecinto.php?id=147
Teatro Lope de Vega de Sevilla,,733,True,,,https://www.proyectomire.org/web/datosrecinto.php?id=148
Centro Cultural de la Villa de Ingenio,Ingenio,514,True,27.91940343255637,-15.444939159857656,https://www.proyectomire.org/web/datosrecinto.php?id=149
Ermua Antzokia de Ermua,,600,True,,,https://www.proyectomire.org/web/datosrecinto.php?id=151
Herriko Antzokia de Elgoibar,,388,True,,,https://www.proyectomire.org/web/datosrecinto.php?id=152
Teatre Municipal Cal Bolet de Vilafranca del Penedès,Vilafranca del Penedès,386,True,41.34407409592663,1.7000095897090184,https://www.proyectomire.org/web/datosrecinto.php?id=153
Teatre de L´Escorxador de Lérida/Lleida,Lleida,310,True,41.611850036500485,0.6151848987368443,https://www.proyectomire.org/web/datosrecinto.php?id=154
Cine Retiro(Societat Recreativa El Retiro) de Sitges,Sitges,701,True,41.2364395,1.8106941,https://www.proyectomire.org/web/datosrecinto.php?id=155
Cinema Rambla de Cambrils,,323,True,,,https://www.proyectomire.org/web/datosrecinto.php?id=156
Teatro Campoamor de Oviedo,Oviedo,1440,True,43.363021496719995,-5.848495735497769,https://www.proyectomire.org/web/datosrecinto.php?id=157
Teatro de Langreo de Langreo,,414,True,,,https://www.proyectomire.org/web/datosrecinto.php?id=158
Teatro de la Laboral(Laboral Ciudad de la Cultura) de Gijón,,1331,True,,,https://www.proyectomire.org/web/datosrecinto.php?id=159
Auditorio-Salón de actos(Casa de Cultura) de San Juan,,521,True,,,https://www.proyectomire.org/web/datosrecinto.php?id=160
Auditorio(Centro Social) de San Vicente del Raspeig,Sant Vicent del Raspeig / San Vicente del Raspeig,380,True,38.39594468870294,-0.5232287624950904,https://www.proyectomire.org/web/datosrecinto.php?id=161
Teatre Monumental de Mataró,,772,True,,,https://www.proyectomire.org/web/datosrecinto.php?id=162
Magatzem de la Ribera de Carcaixent,,800,True,,,https://www.proyectomire.org/web/datosrecinto.php?id=163
Teatre Municipal Don Enrique de Carcaixent,Carcaixent,351,True,39.11622814748929,-0.45143029489365327,https://www.proyectomire.org/web/datosrecinto.php?id=164
Centre Cultural de L´Alcudia,l'Alcúdia,690,True,39.19826705,-0.507056175361447,https://www.proyectomire.org/web/datosrecinto.php?id=165
L´Auditori de Torrent,Torrent,606,True,39.42279471531458,-0.4753791678862888,https://www.proyectomire.org/web/datosrecinto.php?id=166
Teatro Romano de Sagunto,Sagunt / Sagunto,1500,False,39.67935880814962,-0.27835585342293245,https://www.proyectomire.org/web/datosrecinto.php?id=167
Gran Teatre de Alzira,,896,True,,,https://www.proyectomire.org/web/datosrecinto.php?id=168
Centre Cultural de Mislata,Mislata,400,True,39.47277369497986,-0.4143370622049243,https://www.proyectomire.org/web/datosrecinto.php?id=169
Gran Teatro de Manzanares,,710,True,,,https://www.proyectomire.org/web/datosrecinto.php?id=170
Salón de Actos(Casa de Cultura) de Manzanares,,300,True,,,https://www.proyectomire.org/web/datosrecinto.php?id=171
Teatro Auditorio de Cuenca,Cuenca,736,True,40.07654618256079,-2.1283691063736017,https://www.proyectomire.org/web/datosrecinto.php?id=172
Teatro de Rojas de Toledo,Toledo,420,True,39.85777096001137,-4.022721602311142,https://www.proyectomire.org/web/datosrecinto.php?id=173
Gran Teatro de Villarrobledo,Villarrobledo,550,True,39.26779313696617,-2.6055685461310816,https://www.proyectomire.org/web/datosrecinto.php?id=174
Sala Mª Aurelia Capmany(Mercat de les Flors) de Barcelona,Sant Joan de Vilatorrada,800,True,41.7451951,1.8036829,https://www.proyectomire.org/web/datosrecinto.php?id=175
Teatro Villarroel de Barcelona,Barcelona,418,True,41.3845106,2.1574535,https://www.proyectomire.org/web/datosrecinto.php?id=176
Auditori Pau Casals de El Vendrell,el Vendrell,404,True,41.183107145472114,1.5371102257301752,https://www.proyectomire.org/web/datosrecinto.php?id=177
Teatre Auditori Municipal de Sant Feliu de Guíxols,Sant Feliu de Guíxols,386,True,41.781001174804906,3.0256507226912226,https://www.proyectomire.org/web/datosrecinto.php?id=178
Teatre Metropol de Tarragona,,529,True,,,https://www.proyectomire.org/web/datosrecinto.php?id=179
Teatro(Escuela Superior de Arte Dramático) de Murcia,Los Dolores,506,True,37.9840134,-1.127866,https://www.proyectomire.org/web/datosrecinto.php?id=180
Teatro Concha Segura de Yecla,,558,True,,,https://www.proyectomire.org/web/datosrecinto.php?id=181
Auditorio(Casa de Cultura) de La Roda,La Roda,398,True,39.20654097665861,-2.1563733187823706,https://www.proyectomire.org/web/datosrecinto.php?id=182
Teatro Cine Crisfel de Alcázar de San Juan,Alcázar de San Juan,709,True,39.39370885782436,-3.203245821782917,https://www.proyectomire.org/web/datosrecinto.php?id=183
Teatro Victoria de Talavera de la Reina,Talavera de la Reina,371,True,39.959267744917256,-4.83204843106822,https://www.proyectomire.org/web/datosrecinto.php?id=184
Teatro del Palacio de la Audiencia(Centro Cultural Palacio de la Audiencia) de Soria,,525,True,41.717494215102874,-1.8114506769183583,https://www.proyectomire.org/web/datosrecinto.php?id=185
Sala Trajano de Mérida,Mérida,300,True,38.920957,-6.3474187,https://www.proyectomire.org/web/datosrecinto.php?id=186
Teatro Alcázar(Palacio de los Recreos) de Madrid,Madrid,759,True,40.41762175,-3.6989692917634684,https://www.proyectomire.org/web/datosrecinto.php?id=188
Teatro Municipal(Centro Sociocultural) de Valdemoro,Valdemoro,426,True,40.19222655,-3.6766015847497844,https://www.proyectomire.org/web/datosrecinto.php?id=189
Sala García Lorca(Palacio de Exposiciones y Congresos) de Granada,Granada,1999,True,37.16477937694751,-3.600357231174426,https://www.proyectomire.org/web/datosrecinto.php?id=190
Foro Iberoamericano de La Rábida de Palos de la Frontera,Palos de la Frontera,3831,False,37.2132486,-6.9149121,https://www.proyectomire.org/web/datosrecinto.php?id=192
Teatre Fortuny de Reus,Reus,807,True,41.1562605,1.1065328,https://www.proyectomire.org/web/datosrecinto.php?id=193
Teatre Auditori Felip Pedrell de Tortosa,,670,True,,,https://www.proyectomire.org/web/datosrecinto.php?id=194
Sala Sinfónica(Auditori Municipal Enric Granados) de Lérida/Lleida,Lleida,803,True,41.6207223,0.6281857518453433,https://www.proyectomire.org/web/datosrecinto.php?id=195
Teatro Galileo(Centro Cultural Galileo) de Madrid,Madrid,210,True,40.4343169,-3.71840965,https://www.proyectomire.org/web/datosrecinto.php?id=196
Teatro de Móstoles(Centro Cultural Villa de Móstoles) de Móstoles,,558,True,,,https://www.proyectomire.org/web/datosrecinto.php?id=197
Auditorio(Centro Cultural Antonio Machado) de Madrid,Madrid,458,True,40.42138024115288,-3.620707228353853,https://www.proyectomire.org/web/datosrecinto.php?id=198
Auditorio Municipal(Auditorio Municipal Pedro Almodóvar) de Puertollano,,1118,True,,,https://www.proyectomire.org/web/datosrecinto.php?id=199
